categoria;assunto;enunciado;a;b;c;d;e;correta
Arrais Amador;Geral;Nas praias, as embarcações motorizadas como lanchas, moto aquáticas, ultraleves, reboque, paraquedas e painéis de publicidades somente poderão se aproximar até:;100 metros da linha de arrebentação das ondas;200 metros da linha de arrebentação das ondas;300 metros da linha de arrebentação das ondas;400 metros da linha de arrebentação das ondas;500 metros da linha de arrebentação das ondas;200 metros da linha de arrebentação das ondas
Arrais Amador;Geral;Assinale qual das alternativas abaixo é considerada uma situação agravante de uma infração:;idade maior que 18 anos;conluio de duas ou mais pessoas;embriagues ou uso de outra substância entorpecente ou toxica;ter antecedentes criminais;desconhecimento das normas em vigor;embriagues ou uso de outra substância entorpecente ou toxica
Arrais Amador;Geral;De acordo com Regulamento Internacional para Evitar Abalroamento no Mar (RIPEAM), duas motos aquáticas navegam em rumo de colisão (roda a roda). Neste caso a manobra correta será:;ambas param;ambas guinam para boreste;ambas guinam para bombordo;a menor guina para boreste;a maior guina para bombordo;ambas guinam para boreste
Arrais Amador;Geral;As motos aquáticas são definidas como embarcações do tipo:;Embarcação miúda;Embarcação de sobrevivência;Embarcação classificada;Embarcação de médio porte;Embarcação de grande porte;Embarcação miúda
Arrais Amador;Geral;De acordo com a regra 16 do RIPEAM, quando uma embarcação for obrigada a manobrar, a outra embarcação deverá:;Alterar a velocidade;Parar as máquinas;Alterar o seu rumo e velocidade;Manter o seu rumo e velocidade;Alterar apenas o seu rumo;Manter o seu rumo e velocidade
Arrais Amador;Geral;Não inscrever a embarcação acarretará na seguinte penalidade:;A embarcação será retida;Suspensão da carteira de habilitação por até trinta dias;Será aplicada uma multa;A embarcação será apreendida;Suspensão da carteira de habilitação por até sessenta dias;Será aplicada uma multa
Arrais Amador;Geral;De acordo com a NORMAM-03/DPC, Inspeção Naval é definida como:;Atividade de cunho técnico que consiste na fiscalização do cumprimento da LESTA e RLESTA, e das normas e regulamentos dela decorrente;Ação administrativa, eventual ou periódica, pela qual é verificado o cumprimento de requisitos estabelecidos somente em normas nacionais, referente à prevenção da poluição ambiental e às condições de segurança e habitabilidade de embarcações;Ação técnica-administrativa, eventual ou periódica, pela qual é verificado o cumprimento de requisitos estabelecidos somente em normas nacionais, referente à prevenção da poluição ambiental e às condições de segurança e habitabilidade de embarcações;Atividade de cunho administrativo que consiste na fiscalização do cumprimento da LESTA e RLESTA, e das normas e regulamentos dela decorrente;Ação técnica-administrativa, eventual ou periódica, pela qual é verificado o cumprimento de requisitos estabelecidos somente em normas internacionais, referente à prevenção da poluição ambiental e às condições de segurança e habitabilidade de embarcações;Atividade de cunho administrativo que consiste na fiscalização do cumprimento da LESTA e RLESTA, e das normas e regulamentos dela decorrente
Arrais Amador;Geral;Assinale a alternativa incorreta. Não é permitido o tráfego e fundeio de embarcações nas seguintes áreas consideradas de segurança:;canais de acesso aos portos;a menos de duzentos (200) metros das instalações militares;a menos de 300 (trezentos) metros das plataformas de petróleo;fundeadouros de navios mercantes;áreas próximas às usinas hidrelétricas, termoelétricas e nucleoelétricas, cujos limites serão fixados e divulgados pelas concessionárias responsáveis pelo reservatório de água, em coordenação com o CP, DL ou AG da área;a menos de 300 (trezentos) metros das plataformas de petróleo
Arrais Amador;Geral;A transmissão de calor que se processa sem necessidade de continuidade molecular entre a fonte calorífica e o corpo que recebe calor é um método de transmissão denominado de:;Condução;Convecção;Irradiação;Inflamação;Nenhuma das Alternativas;Irradiação
Arrais Amador;Geral;Uma embarcação com um hélice, com rotação para direita, com leme a bombordo, partindo do repouso com máquina a vante, a proa guinará;bombordo lentamente;boreste lentamente;bombordo rapidamente;bombordo muito lentamente;bombordo muito rapidamente;bombordo rapidamente
Arrais Amador;Geral;Uma embarcação com um hélice, com rotação para direita, com leme a meio, partindo do repouso com máquina a vante, para;Boreste;Bombordo;Bombordo lentamente;Bombordo rapidamente;Boreste rapidamente;Bombordo lentamente
Arrais Amador;Geral;Uma embarcação com um hélice, com rotação para direita, com leme a boreste (BE), partindo do repouso com máquina a vante, para;Boreste rapidamente;Boreste Lentamente;Boreste;Bombordo;Bombordo lentamente;Boreste Lentamente
Arrais Amador;Geral;Uma embarcação com um hélice, com rotação para direita, com leme a bombordo (BB), com segmente a vante, para;Boreste lentamente ou a caminho;Boreste;Bombordo;Bombordo lentamente ou a caminho;Bombordo rapidamente;Bombordo
Arrais Amador;Geral;Uma embarcação com um hélice, com rotação para direita, com leme a meio, com segmente a vante, para;Boreste rapidamente;Boreste lentamente;Boreste;Bombordo;Bombordo lentamente;Bombordo
Arrais Amador;Geral;Uma embarcação com um hélice, com rotação para direita, com leme a meio, com segmente a vante, para;Boreste lentamente;Boreste;Bombordo;Bombordo lentamente ou a caminho;Bombordo lentamente;Boreste lentamente
Arrais Amador;Geral;Uma embarcação com um hélice, com rotação para direita, com leme a boreste (BE), com segmente a vante, para;Boreste rapidamente;Boreste lentamente;Boreste;Bombordo;Bombordo lentamente ou a caminho;Boreste
Arrais Amador;Geral;Uma embarcação com um hélice, com rotação para direita, com leme a bombordo (BB), partindo do repouso com máquina a aré, para;Boreste;Bombordo;Bombordo lentamente;Boreste rapidamente;Boreste Muito Lentamente;Boreste Muito Lentamente
Arrais Amador;Geral;Uma embarcação com um hélice, com rotação para direita, com leme a meio, partindo do repouso com máquina a aré, para;Boreste rapidamente;Bombordo;Boreste;Bombordo lentamente;Boreste Lentamente;Boreste Lentamente
Arrais Amador;Geral;Uma embarcação com um hélice, com rotação para direita, com leme a boreste (BE), partindo do repouso com máquina a aré, para;Bombordo;Boreste rapidamente;bombordo rapidamente;bombordo muito lentamente;Boreste Lentamente;Boreste Lentamente
Arrais Amador;Geral;Uma embarcação com um hélice, com rotação para direita, com leme a bombordo (BB), com segmente a aré, para;Boreste rapidamente;Boreste;Bombordo lentamente;Bombordo;Bombordo rapidamente;Boreste rapidamente
Arrais Amador;Geral;Uma embarcação com um hélice, com rotação para direita, com leme a meio, com segmente a aré, para;Bombordo Lentamente;Boreste;Bombordo lentamente ou a caminho;Bombordo;Boreste Lentamente;Boreste Lentamente
Arrais Amador;Geral;Uma embarcação com um hélice, com rotação para direita, com leme a boreste (BE), com segmente a aré, para;Boreste rapidamente;Bombordo lentamente;Boreste Lentamente ou a caminho;Boreste lentamente;Bombordo rapidamente;Boreste Lentamente ou a caminho
Arrais Amador;Geral;As âncoras são peças metálicas capazes de:;Prender no fundo para permitir que a embarcação garre;Fundear nos fundeadouros de boa tença;Prender no fundo, para permitir que a embarcação se mantenha fundeada, ou seja, sem se deslocar da posição;Fundear nos fundeadouros com vento forte ou correnteza, para evitar que a embarcação garre.;Usada para desatracar a embarcação;Prender no fundo, para permitir que a embarcação se mantenha fundeada, ou seja, sem se deslocar da posição
Arrais Amador;Geral;Qual o nome da corrente na superfície da água formada pelo vento?;Corrente de maré;Corrente de vazante;Corrente de esteira;Corrente de pressão;Corrente de deriva;Corrente de deriva
Arrais Amador;Geral;O que são amarras?;Elos que servem para prender a âncora ao Anete;Elos ou cabo que serve para prender a âncora ao porão da amarra;Elos ou cabo que serve para prender a âncora ao paiol da amarra ou ao convés da embarcação;Elos o cabo que serve para prender a âncora ao escovem da embarcação;Elos de nylon;Elos ou cabo que serve para prender a âncora ao paiol da amarra ou ao convés da embarcação
Arrais Amador;Geral;Dos documentos citados abaixo, qual regulamenta a lei de segurança do tráfego aquaviario em águas brasileiras?;NORMAM-211;Decreto2.596/98-RLESTA;Convenção da IMO;Lei federal 7.661/88;Solas 74;Decreto2.596/98-RLESTA
Arrais Amador;Geral;Medido da boca, do convés principal de BE até BB, sem contar quilha ou bolina:;boca moldada;borda livre;contorno;Trin;Roda de proa;contorno
Arrais Amador;Geral;Reconhece-se uma bóia:;pelo formato e sua cor;pelo tope;pela cor da luz e ritmo dos lampejos;todas as alternativas;Nenhuma das alternativas;todas as alternativas
Arrais Amador;Geral;a expressão aduchar significa:;puxar;folgar;deixar arrumado um cabo para pronto uso;amarrar;esticar;deixar arrumado um cabo para pronto uso
Arrais Amador;Geral;O que deve ser tentado no caso de parada cardíaca, e que às vezes funciona, de imediato?;respiração boca a boca;massagem nos punhos;aquecimento do corpo;murro forte no peito;choque elétrico;murro forte no peito
Arrais Amador;Geral;Caso exista risco de incêndio ou de explosão em local próximo à vítima fraturada eu deverei: ?;realizar a imobilização rapidamente e, logo após, removê-la do local;removê-la primeiro do local de risco;realizar a imobilização, independente do risco;dar combate ao risco primeiro, deixando a vítima esperando;usar extintor para evitar a explosão;removê-la primeiro do local de risco
Arrais Amador;Geral;Quantos litros de sangue temos no organismo?;6 litros;4 litros;8 litros;10 litros;7 litros;6 litros
Arrais Amador;Geral;O nome do dispositivo utilizado para imobilizar ossos quebrados, por meio de tiras de pano a ele amarradas é:;tala;material isolante;torniquete;tampão;gase;tala
Arrais Amador;Geral;Qual a frequência de sopros por minuto, numa respiração boca a boca?;10 a 15;15 a 20;20 a 30;mais de 30;mais de 40;15 a 20
Arrais Amador;Geral;O que deve ser feito antes de iniciar um atendimento de primeiros socorros?;Agir impulsivamente;Pensar antes de atuar;Aproximar-se da vítima sem verificar a segurança;Movimentar a vítima imediatamente;Dar líquidos à vítima inconsciente;Pensar antes de atuar
Arrais Amador;Geral;Em caso de hemorragia, o que deve ser feito após 30 minutos de torniquete?;Desapertar o torniquete e reapertá-lo, independente de ter parado a hemorragia;Manter o torniquete apertado;Remover o torniquete completamente;Aplicar gelo na área;Dar líquidos à vítima;Desapertar o torniquete e reapertá-lo, independente de ter parado a hemorragia
Arrais Amador;Geral;Qual é a primeira etapa básica na prestação dos primeiros socorros?;Movimentar a vítima;Avaliar o cenário;Dar líquidos à vítima;Aplicar torniquete;Realizar respiração boca a boca;Avaliar o cenário
Arrais Amador;Geral;O que deve ser observado para uma melhor avaliação do cenário de um acidente?;Manter curiosos próximos para ajudar;Observar perigos ao acidentado;Movimentar a vítima imediatamente;Dar combate ao risco primeiro;Aplicar massagem cardíaca;Observar perigos ao acidentado
Arrais Amador;Geral;Qual é o procedimento correto se houver perigo iminente no local do acidente?;Movimentar a vítima imediatamente;Adotar o procedimento de retirada da vítima;Esperar por ajuda especializada;Aplicar torniquete;Dar líquidos à vítima;Adotar o procedimento de retirada da vítima
Arrais Amador;Geral;Qual a característica da queimadura de 4º grau?;são indolores;são extremamente doloridas;causam rápida destruição dos tecidos;não podem ser tratadas por socorristas;causam vermelhidão na pele;são indolores
Arrais Amador;Geral;Uma pessoa que passou longo tempo em ambientes muito aquecidos poderá ser vítima de:;insolação;hipotermia;intermação;hemostasia;hemorragia;intermação
Arrais Amador;Geral;Qual a cor da pele de uma pessoa envenenada por gases?;Esbranquiçada;Esverdeada;Amarelada;Azulada;rosada;Azulada
Arrais Amador;Geral;O que fazer em caso de hipotermia?;aquecê-lo de forma lenta e gradual;aquecê-lo rapidamente;fazer massagens;dar bebidas alcoólicas;dar bastante líquidos;aquecê-lo de forma lenta e gradual
Arrais Amador;Geral;No caso de ingestão de substâncias corrosivas, diluir ou neutralizar essas substâncias pela ingestão de:;remédios para enjôo;bebidas geladas;chocolate ou derivados de leite;água ou leite;glicose;água ou leite
Arrais Amador;Geral;O que deve ser feito em caso de queimaduras por radiação?;Aplicar gelo imediatamente;Usar pomadas específicas;Lavar com água corrente e procurar atendimento médico;Cobrir com gaze estéril;Aplicar álcool;Lavar com água corrente e procurar atendimento médico
Arrais Amador;Geral;Qual é a primeira coisa a fazer ao encontrar uma vítima inconsciente?;Dar líquidos;Verificar se ela respira;Movimentar a vítima;Aplicar torniquete;Fazer massagem cardíaca;Verificar se ela respira
Arrais Amador;Geral;O que caracteriza uma queimadura de 3º grau?;Destruição completa da derme;Bolhas de água;Vermelhidão na pele;Ausência de dor;Muita dor;Destruição completa da derme
Arrais Amador;Geral;Qual é a ação correta em caso de intermação?;Retirar a vítima do local e aquecê-la;Dar líquidos gelados;Aplicar compressas de água fria;Deixar a vítima no local e chamar ajuda;Movimentar a vítima rapidamente;Aplicar compressas de água fria
Arrais Amador;Geral;O que deve ser feito em caso de insolação?;Retirar a vítima do sol e refrescá-la com água corrente fresca;Aplicar gelo diretamente na pele;Dar bebidas alcoólicas;Deixar a vítima no local e chamar ajuda;Movimentar a vítima rapidamente;Retirar a vítima do sol e refrescá-la com água corrente fresca
Arrais Amador;Geral;Qual é a primeira coisa a fazer ao encontrar uma vítima de acidente?;Movimentar a vítima;Verificar a segurança do local;Dar líquidos;Aplicar torniquete;Fazer massagem cardíaca;Verificar a segurança do local
Arrais Amador;Geral;O que caracteriza uma queimadura de 2º grau?;Destruição completa da derme;Bolhas de água;Vermelhidão na pele;Ausência de dor;Muita dor;Bolhas de água
Arrais Amador;Geral;Qual é a ação correta em caso de queimadura por eletricidade?;Aplicar gelo imediatamente;Usar pomadas específicas;Lavar com água corrente e procurar atendimento médico;Cobrir com gaze estéril;Aplicar álcool;Lavar com água corrente e procurar atendimento médico
Arrais Amador;Geral;O que deve ser feito em caso de fratura exposta?;Movimentar a vítima;Imobilizar a área afetada;Aplicar torniquete;Dar líquidos;Fazer massagem cardíaca;Imobilizar a área afetada
Arrais Amador;Geral;Qual é a primeira coisa a fazer ao encontrar uma vítima de afogamento?;Movimentar a vítima;Verificar se ela respira;Dar líquidos;Aplicar torniquete;Fazer massagem cardíaca;Movimentar a vítima
Arrais Amador;Geral;O que caracteriza uma queimadura de 1º grau?;Destruição completa da derme;Bolhas de água;Vermelhidão na pele;Ausência de dor;Muita dor;Vermelhidão na pele
Arrais Amador;Geral;Qual é a ação correta em caso de queimadura por produtos químicos?;Aplicar gelo imediatamente;Usar pomadas específicas;Lavar com água corrente;Cobrir com gaze estéril;Aplicar álcool;Lavar com água corrente
Arrais Amador;Geral;O que deve ser feito em caso de choque elétrico?;Movimentar a vítima;Desligar a fonte de eletricidade;Aplicar torniquete;Dar líquidos;Fazer massagem cardíaca;Desligar a fonte de eletricidade
Arrais Amador;Geral;Qual é a primeira coisa a fazer ao encontrar uma vítima de envenenamento?;Movimentar a vítima;Verificar se ela respira;Dar líquidos;Aplicar torniquete;Fazer massagem cardíaca;Verificar se ela respira
Arrais Amador;Geral;O que caracteriza uma queimadura de 4º grau?;Destruição completa da derme;Bolhas de água;Vermelhidão na pele;Ausência de dor;Muita dor;Ausência de dor
Arrais Amador;Geral;Qual é a ação correta em caso de queimadura por radiação?;Aplicar gelo imediatamente;Usar pomadas específicas;Lavar com água corrente;Cobrir com gaze estéril;Aplicar álcool;Lavar com água corrente
Arrais Amador;Geral;O que deve ser feito em caso de fratura fechada?;Movimentar a vítima;Imobilizar a área afetada;Aplicar torniquete;Dar líquidos;Fazer massagem cardíaca;Imobilizar a área afetada
Arrais Amador;Geral;Qual é a primeira coisa a fazer ao encontrar uma vítima de queimadura?;Movimentar a vítima;Verificar se ela respira;Dar líquidos;Aplicar torniquete;Fazer massagem cardíaca;Verificar se ela respira
Arrais Amador;Geral;O que caracteriza uma queimadura de 2º grau?;Destruição completa da derme;Bolhas de água;Vermelhidão na pele;Ausência de dor;Muita dor;Bolhas de água
Arrais Amador;Geral;Qual é a ação correta em caso de queimadura por produtos químicos?;Aplicar gelo imediatamente;Usar pomadas específicas;Lavar com água corrente;Cobrir com gaze estéril;Aplicar álcool;Lavar com água corrente
Arrais Amador;Geral;O que deve ser feito em caso de crise epiléptica?;Segurar a pessoa e tentar conter os movimentos para evitar lesões;Colocar um objeto na boca da pessoa para evitar que ela engula a língua;Jogar água fria no rosto da pessoa para tentar despertá-la;Manter a pessoa deitada de lado, proteger sua cabeça e afastar objetos perigosos;Aplicar respiração boca a boca imediatamente para evitar falta de oxigênio;Manter a pessoa deitada de lado, proteger sua cabeça e afastar objetos perigosos
Arrais Amador;Geral;Qual é a primeira coisa a fazer ao encontrar uma vítima de envenenamento?;Movimentar a vítima;Verificar se ela respira;Dar líquidos;Aplicar torniquete;Fazer massagem cardíaca;Verificar se ela respira
Arrais Amador;Geral;O que caracteriza uma queimadura de 1º grau?;Destruição completa da derme;Bolhas de água;Vermelhidão na pele;Ausência de dor;Muita dor;Vermelhidão na pele
Arrais Amador;Geral;Qual é a ação correta em caso de queimadura por radiação?;Aplicar gelo imediatamente;Usar pomadas específicas;Lavar com água corrente;Cobrir com gaze estéril;Aplicar álcool;Lavar com água corrente
Arrais Amador;Geral;Qual é a primeira coisa a fazer ao encontrar uma vítima de acidente de trânsito?;Movimentar a vítima;Verificar a segurança do local;Dar líquidos;Aplicar torniquete;Fazer massagem cardíaca;Verificar a segurança do local
Arrais Amador;Geral;O que é uma embarcação ou navio?;Uma construção feita de madeira, concreto, aço, alumínio ou da combinação desses materiais, que flutua e é destinada a transportar pela água pessoas e/ou cargas diversas.;Uma tipo de embarcação usada exclusivamente em rios.;Uma embarcação que não pode ser usado em mares abertos.;Uma embarcação destinado apenas para transporte de cargas sólidas.;Uma construção feita apenas de aço, que flutua e transporta pessoas.;Uma construção feita de madeira, concreto, aço, alumínio ou da combinação desses materiais, que flutua e é destinada a transportar pela água pessoas e/ou cargas diversas.
Arrais Amador;Geral;"Qual é a definição de ""barco""?";Uma embarcação de grande porte.;Uma embarcação de pequeno porte, com ou sem coberta.;Uma embarcação destinada exclusivamente ao transporte de cargas líquidas.;Uma embarcação de médio porte com coberta.;Uma embarcação destinada exclusivamente ao transporte de passageiros.;Uma embarcação de pequeno porte, com ou sem coberta.
Arrais Amador;Geral;"O que significa ""a vante""?";Parte traseira do navio.;Parte superior do navio.;Parte inferior do navio.;Parte dianteira do navio, na proa.;Parte central do navio.;Parte dianteira do navio, na proa.
Arrais Amador;Geral;"O que é ""borda-falsa""?";Parapeito do navio no convés.;Parte externa da proa.;Parte inferior do casco.;Invólucro do casco abaixo da linha d’água.;Parte curva do costado próximo à popa.;Parapeito do navio no convés.
Arrais Amador;Geral;O que caracteriza o lado direito da embarcação?;Chama-se bombordo e é caracterizado pela cor verde.;Chama-se boreste e é caracterizado pela cor verde.;Chama-se bombordo e é caracterizado pela cor encarnada.;Chama-se boreste e é caracterizado pela cor vermelha.;Chama-se Bombordo e é caracterizado pela cor encarnada.;Chama-se boreste e é caracterizado pela cor verde.
Arrais Amador;Geral;"O que é ""calado ?";A medida da altura do casco até a quilha.;A medida da altura do casco até o convés principal.;A medida da altura, desde a quilha até a superfície da água.;A medida da largura do navio na meia-nau.;medida da largura do navio na proa.;A medida da altura, desde a quilha até a superfície da água.
Arrais Amador;Geral;Qual âncora é mais comum para embarcações de lazer?;Âncora Danforth;Âncora Bruce;Âncora Arado;Âncora Garateia;Âncora Almirantado;Âncora Danforth
Arrais Amador;Geral;O que é convés principal ?;O primeiro pavimento contínuo de proa a popa, descoberto em todo ou em parte.;O pavimento contínuo de popa a proa.;O pavimento inferior do navio.;O pavimento superior do navio.;O pavimento destinado ao armazenamento de cargas.;O pavimento contínuo de popa a proa.
Arrais Amador;Geral;"O que é ""costado""?";Invólucro do casco acima da linha d’água.;Parte interna do casco.;Parte inferior do casco.;Parte externa do casco abaixo da linha d’água.;Parte central do casco.;Invólucro do casco acima da linha d’água.
Arrais Amador;Geral;"O que são ""obras vivas""?";Parte do casco que fica acima do plano de flutuação.;Parte do casco abaixo do plano de flutuação em plena carga.;Parte central do casco.;Parte traseira do casco.;Parte dianteira do casco.;Parte do casco abaixo do plano de flutuação em plena carga.
Arrais Amador;Geral;"Qual a função da ""buzina"" em uma embarcação?";Serve como alarme sonoro.;Guia os cabos de amarração dos navios.;Ajuda na navegação em mar aberto.;Serve para sinalização de emergência.;Auxilia na comunicação com outras embarcações.;Guia os cabos de amarração dos navios.
Arrais Amador;Geral;"O que é ""alheta""?";Parte central da embarcação.;Parte dianteira da embarcação.;Parte curva da embarcação nas proximidades da popa.;Parte traseira da embarcação.;Parte superior da embarcação.;Parte curva da embarcação nas proximidades da popa.
Arrais Amador;Geral;"O que é ""fundear""?";Içar a âncora do fundo do mar.;Lançar uma âncora ao fundo do mar para manter a embarcação parada.;Navegar em águas profundas.;Atracar a embarcação em um cais.;Realizar manobras de emergência.;Lançar uma âncora ao fundo do mar para manter a embarcação parada.
Arrais Amador;Geral;"O que é ""borda livre""?";A altura do casco acima da linha d’água.;A distância vertical entre a superfície da água e o convés principal.;A distância horizontal entre a proa e a popa.;A largura do casco na meia-nau.;altura do mastro principal.;A distância vertical entre a superfície da água e o convés principal.
Arrais Amador;Geral;"O que é ""superestrutura""?";Construção feita sobre o convés principal.;Parte inferior do casco.;Parte traseira do casco.;Parte dianteira do casco.;Parte central do casco.;Construção feita sobre o convés principal.
Arrais Amador;Geral;"O que é um ""traves""?";Uma parte da embarcação.;Uma posição perpendicular à embarcação.;Uma posição paralela à embarcação.;Uma posição diagonal à embarcação.;Uma posição acima da embarcação.;Uma posição perpendicular à embarcação.
Arrais Amador;Geral;"O que é ""ancoradouro""?";Local onde a embarcação é construída.;Local onde a embarcação está fundeada.;Local onde a embarcação é reparada.;Local onde a embarcação é armazenada.;;Local onde a embarcação está fundeada.
Arrais Amador;Geral;"Qual é a função de um ""espringue""?";Evitar que a embarcação caia a avante ou a ré.;Evitar que a embarcação se afaste do cais.;Guiar os cabos de amarração.;Sinalizar a posição da embarcação.;Servir como defesa contra choques.;Evitar que a embarcação caia a avante ou a ré.
Arrais Amador;Geral;"O que é ""filame""?";Comprimento da amarra necessário para fundear a embarcação.;Tipo de âncora usada em embarcações de lazer.;Tipo de cabo usado para amarrar a embarcação.;Tipo de corrente usada para amarrar a embarcação.;Tipo de boia usada para marcar o local de fundeio.;Comprimento da amarra necessário para fundear a embarcação.
Arrais Amador;Geral;"O que é ""tença""?";Tipo de fundo do mar ou fundeadouro.;Tipo de corrente usada na amarração.;Tipo de âncora usada em embarcações pequenas.;Tipo de cabo usado para amarrar a embarcação.;Tipo de boia usada para marcar o local de fundeio.;Tipo de fundo do mar ou fundeadouro.
Arrais Amador;Geral;Quando há correnteza e vento pela popa, qual é o primeiro passo para desatracar?;Soltar os cabos de proa e dar comandos para adiante;Soltar os cabos de popa e dar comandos para adiante;Soltar os cabos de popa e dar comandos para trás;Soltar os cabos de proa e dar comandos para trás;Soltar os cabos de ambos os lados e dar comandos para trás;Soltar os cabos de popa e dar comandos para adiante
Arrais Amador;Geral;Para auxiliar na desatracação com vento e correnteza pela popa, qual equipamento é utilizado?;Espringue de Popa;Espringue de Meia-nau;Espringue de Proa;Espringue de Bombordo;Espringue de Boreste;Espringue de Proa
